{
  "schemaVersion": "1.0.0",
  "catalogId": "gemuera.m0.legacy-save-baseline",
  "catalogVersion": "1.0.0",
  "sourceWorkPackage": "M0-SAV-01",
  "expectedSourceFileCount": 5,
  "sources": [
    {"relativePath":"Scripts/Emuera/Sub/EraBinaryDataReader.cs","sha256":"72d4d8041799d61e7c1379bdc7af18071054e56601709a027e98353d46018014","byteLength":31720},
    {"relativePath":"Scripts/Emuera/Sub/EraBinaryDataWriter.cs","sha256":"bb963bce35f50f0a8d60c3d461aef4b4ce509e5de4d318383315fc2f27f1cf53","byteLength":13666},
    {"relativePath":"Scripts/Emuera/GameData/Variable/VariableEvaluator.cs","sha256":"920fab29e87cdb00ab73be41ef051fadf13e078537e2921a29fafdcbf2450e42","byteLength":118924},
    {"relativePath":"Scripts/Emuera/GameData/Variable/VariableData.cs","sha256":"4d83f6f6946301968e0268771e26fc564fd56e80869d5ebc0c907ef9bf047f7c","byteLength":66269},
    {"relativePath":"Scripts/Emuera/GameData/Variable/CharacterData.cs","sha256":"970bc419bd65e1633e57837faced3b80f914abfbb0c82c87f8f9697996d0211c","byteLength":39537}
  ],
  "header": {"headerHex":"0x0A1A0A0D41524589","zipHeaderHex":"0x0A50495A41524589","formatVersion":1808,"dataCount":0,"minimumBytes":16,"encoding":"Encoding.Unicode"},
  "expectedFileTypes": [
    {"id":"Normal","hexCode":"0x00","pathForms":["save{index:00}.sav","save{name:00}.sav"],"writerMethod":"SaveToStreamBinary","readerMethod":"LoadFromStreamBinary"},
    {"id":"Global","hexCode":"0x01","pathForms":["global.sav"],"writerMethod":"WriteGlobalSaveStream","readerMethod":"LoadGlobal"},
    {"id":"Var","hexCode":"0x02","pathForms":["var_{id}.dat"],"writerMethod":"SaveVariable","readerMethod":"LoadVariable"},
    {"id":"CharVar","hexCode":"0x03","pathForms":["chara_{id}.dat"],"writerMethod":"SaveChara","readerMethod":"LoadChara"}
  ],
  "expectedDataTypes": [
    {"id":"Int","hexCode":"0x00"},{"id":"IntArray","hexCode":"0x01"},{"id":"IntArray2D","hexCode":"0x02"},{"id":"IntArray3D","hexCode":"0x03"},
    {"id":"PcFloat","hexCode":"0x04"},{"id":"PcFloatArray","hexCode":"0x05"},{"id":"PcFloatArray2D","hexCode":"0x06"},{"id":"PcFloatArray3D","hexCode":"0x07"},
    {"id":"Str","hexCode":"0x10"},{"id":"StrArray","hexCode":"0x11"},{"id":"StrArray2D","hexCode":"0x12"},{"id":"StrArray3D","hexCode":"0x13"},
    {"id":"Float","hexCode":"0x20"},{"id":"FloatArray","hexCode":"0x21"},{"id":"FloatArray2D","hexCode":"0x22"},{"id":"FloatArray3D","hexCode":"0x23"},
    {"id":"Separator","hexCode":"0xFD"},{"id":"EOC","hexCode":"0xFE"},{"id":"EOF","hexCode":"0xFF"}
  ],
  "expectedSparseMarkers": [
    {"id":"Byte","hexCode":"0xCF"},{"id":"Int16","hexCode":"0xD0"},{"id":"Int32","hexCode":"0xD1"},{"id":"Int64","hexCode":"0xD2"},{"id":"String","hexCode":"0xD8"},
    {"id":"EoA1","hexCode":"0xE0"},{"id":"EoA2","hexCode":"0xE1"},{"id":"Zero","hexCode":"0xF0"},{"id":"ZeroA1","hexCode":"0xF1"},{"id":"ZeroA2","hexCode":"0xF2"},{"id":"EoD","hexCode":"0xFF"}
  ],
  "profileConflict": {"candidateSaveProfileIds":["Upstream1808","GEmueraSnake"],"legacyFloatCodes":["0x20","0x21","0x22","0x23"],"upstreamConflictingCodes":["0x20","0x21","0x22"],"automaticSelectionStatus":"Unbound"},
  "legacyMutationEvidence": [
    {"id":"normal-load-resets-variable-state","relativePath":"Scripts/Emuera/GameData/Variable/VariableEvaluator.cs","requiredLiterals":["varData.SetDefaultValue(constant);","varData.CharacterList.Clear();"]},
    {"id":"normal-load-clears-save-runtime-data-before-parse","relativePath":"Scripts/Emuera/GameData/Variable/VariableEvaluator.cs","requiredLiterals":["RuntimeDataStore.ClearSaveData(constant);"]}
  ]
}
